<?xml version="1.0" encoding="UTF-8"?>
<clientes xmlns="http://www.globalcode.com.br/ae/clientes" 
		xmlns:xsi="http://www.w3.org/2001/XMLSchema-instance"
		xsi:schemaLocation="http://www.globalcode.com.br/ae/clientes clientes.xsd" >
	
	<cliente>
		<nome>Eduardo Wallace</nome>
		<dataNascimento dia="12" mes="12" ano="83" /> 
		<email>edubossa@gmail.com</email>
	</cliente>
	
	<cliente>
		<nome>Juca da Silva</nome>
		<idade>23</idade>
		<email>juca1@gmail.com</email>
		<email>juca2@gmail.com</email>
		<email>juca3@gmail.com</email>
	</cliente>
	
</clientes>